Hash,Message
58f8db35e,"avoid breaking backward comatability The weblogicDTD attribute in ant 1.2 was used to give the location Af the weblogic version of the generic ejb-jar DTD. In recent 1.3alpha builds this role was taken by ejbdtd and the weblogicdtd attribute was now used to locate the weblogic deployment descriptor's DTD. Whilst sensible, this breaks backward comatability."
8c9791172,Updated to the version on harddisk + added the start of documentation.
8c3b761ae,Give a warning when the weblogic deployment descriptor cannot be found.
b60d024fe,Fix up a minor method name typo
b88306484,Add ignores so cvs update output cleaner
de2273f0a,Remove uneeded interface.
d42256bf5,Add classpath attributes and elements to <property> to specify a classpath to load resources from.
77ed2ceec,Changed <available> to resolve relative resource names the same way as <property> does.
113e9e764,Fix some testcases.
a50ad9fae,Resolve confusion between <fileset> and <prefixedfileset> in <zip> and friends.
ffa6e24ba,Document that Task.execute() can be invoked more than once.
1056b715f,"Added *internal* support multiple projects, and generalized the selection state mechanism."
a4a48c3be,No longer needed.
ebb7f7ca8,Fixed redraw bug.
febf421b2,Change the addition of super classes and super interfaces
1263b3640,Documentation update for the new param element of the style task and other style task changes.
320a0390b,Propagate Sam's build.sysclasspath magic to <rmic> as well.
53def3821,"Added full support for multiple projects open at the same time. Each project appears as an entry in the ""Projects"" menu."
79d1102c4,"Restore the default to ""last"".  Add a warning message if an invalid value is specified."
1a23fe526,Updated UML diagrams.
5ce408829,Major documentation update.
1e3eecb41,Give Diane some credit. I have commited her update but you may not see the commit due to its size.
6cd17eeff,Remove debug statement - oops!
d5362445c,Added VSS label task.
568f34ca1,Add in extra error case when creating directories.
be3b48e2d,Good docs to the recue !!!
94ed3da95,Fixed documentation of Loggers and made default value of log level explicit.
268ddaabd,Cleanup and debug support.
7f4d63359,Cleaned up standard ctor.
51073339a,Fixed bug where location wasn't getting set.
8f7d91aac,"Added initial support for creating a new, empty project."
11b6cebd0,Added support for updating display based on property change events in the data model.
972b09b40,Fixed bug where properties editor wasn't geting cleared when the project was closed.
eb2f41888,Fix up line endings
c71214044,Started rewrite of tree model to remove ACS dependency on TreeNode.
c1a5419fa,Made CMP warning only at verbose level.
4ca5683c2,<javac> rewritten to use a factory.
6ffa5bb1c,Add missing gif files for VAJAntTool.html
98dab9171,VAJ IDE integration classes.
df3ce6106,Updates on the perforce tasks + documentation.
237bbc895,Added ability to add new targets.
b2abffd01,Added rough ability to add new tasks (javac only) and properties.
701a0156d,Updated
822028744,Updated docs
b641968fa,Enhanced replace task - docs pending.
bb67dc44d,Initial framework for a build-file wizzard.
e99e5c5fc,Wizzard tweaks.
9b5fd7baa,"Change ejbjar so ""up to date"" is only printed in verbose mode. Submitted by:	Jason Rosenberg <jason@squaretrade.com>"
afe0093bd,Make warning about unset properties only appear at VERBOSE level.
f0ffaff10,Added documentation for threcent addition ofipFileset facilities.
54b84962a,"Addition ofipFileset facilities. Descibed by the author ---  With these patches,ip (and derivative tasks such as Jar and War) can  merge the entries of multipleip files into a single outputip file.  The contents of an inputip file may be selectively extracted based on  include/exclude patterns."
65e71c5f8,"Addition ofipFileset facilities. Descibed by the author ---  With these patches,ip (and derivative tasks such as Jar and War) can  merge the entries of multipleip files into a single outputip file.  The contents of an inputip file may be selectively extracted based on  include/exclude patterns."
1ca1ee1ab,Documented replacefilter.
6a4bbe2d7,Made documents easier to peruse by adding frames
6500a507b,"Handle directories with # in them by passing the parser an inputstream, rather than a name."
f8a715c36,Added first version of FSD
97ba08300,moved original specification to here
28d98d088,moved original specification to docs/ant2
05d67d513,"Make sure we are invoking the correct javac, remove old optional.jar as well."
b2f645230,Fixed Typo.
faf459ad4,"Successfully managed to expose myself to public embarassssment by mispellln' ""wizzzerd"" all over the place. :-("
ff8c3b2b3,Initial commit
2e364fd66,"Testing rig. Not totally generallized, but helpful."
44ae47f5c,Added editor for properties of type 'File'.
c87973d59,Changed semantics of initializing with a null value. Now a default value is created.
dba8c836d,Added property editor for generic Object with no special property editor.
a31bb63e4,Fixed bug where change event was not getting fired.
f9ddec7b8,Fix a few things that jumped out at me when Stefan put the Javac change through. (And verify I can really commit!)
18931f719,"Added more panels to build wizard, and created state machine framework."
9d48fbb8c,added ability to define the begin/end tokens for the filtering.
adbdf5d6c,rolling back Josh's changes until he provides a better patch. :-)
62d641e01,"Brainstormed list of requested features for Ant2. This is far from being a functional-requirements document, just a start."
b3cb9a9d4,Changed the handling of build.sysclasspath so that Ant should behave the same way as Ant 1.2 did - if build.sysclasspath has not been set.
06f6d787d,"Add some sanity checks. If we allow an empty token, we end up in an endless loop - as demonstrated by unittest test4."
9f05cd3fd,And token attribute of <replacefilter> must not be empty either.
7d2447319,Forgot to add a testcase for replace.
dbecca155,"Catch NoClassDefFoundErrors. These indicate that while a superclass is available on the classpath, a class it depends on is not. As this code is currently catching ClassNotFound exceptions anyway, this is not a major change. It will log a warning."
9bc78e6c2,Change to IntrospectionHelper to support creation of nested elements through a createElement(String elementName) factory method. This has two applications.
6ca00c239,Allow ejbjar to specify support classes.
fbe81719e,Do not compress jars when rebuild=false
fc9085997,Remove the concept of a factory method for creating nested elements
64d1ec0cf,Changed <support-classes> to <support> in <ejbjar> tag.
415946f00,"- There was an ugly line-break and system was duplicate. - Error message for unknown arguments know reads ""Unknown argument"" instead of ""Unknown arg"""
a5896abdf,Added a hint to index.html about where to find optional tasks.
6c9755c31,If SQLExec reads the statements from a file this file is now propertly closed after execution.
021634e2b,If directory is specified test if it's a valid one.
1c59975f5,TarEntry.java was validating the maximum length for filenames only in one place. The tar-task used another constructor. Simply copied the verification to the other constructor to do the check there also. Now throws a RuntimeException.
d91317f48,Removed some unused settings.
92e1bc080,Added ^M's so it is easier for peeps working on windows who check out using unix style linefeeds.
4a79f3ef1,Fix documentation for Get task
1ba24b5b3,Removed ^Ms
4403acbb6,"Added one of Jim's ""Task Axioms"" to the list - I think the first one is already covered while the third one seems to be revoked by Jim himself."
6cc1290e8,Hack to ignore CVS directories.
b6d17002e,Back out CVS directory hack.
c17ffac92,Fixed empty directory count message
746290bbe,Fixed problem with quiet flag preventing deletes.
27491607d,Checked in alpha version of new build system.
767cb3800,Added in forgotten junit.jar
14af9cb04,The C shell doesn't work with the script. Updated to BASH (linux folks on other OSes sh!=bash). Changed a forward slash with a back slash wich prevents bootstrapping on unix machines. PR: Obtained from: Submitted by: Reviewed by:
d0117ae16,Work in almost all of Conors suggestions
b4dcbaf0a,Added dist.base to complete all recomends of Conor
99f86d503,Fixed errors wrt
44df0664d,Made sure environment is left cleaner
4d88a515a,Made sure environment is left cleaner
9ef45a287,removed debug echoing
4f09ca603,Made sure defaultManifest.mf is included in ant.jar
3848061ea,Update to new build scripts Correct version string call bootstrap.bat Introduce an install-lite target Move building of distributions files out of dist target
3dd90bd41,Fix typo on classpath Include system class path so optional packages can be found.
fd2eebccc,Fixed test for Main.class and NEW_ANT_HOME.
af102bbd3,"Resolving package names now occurs with the use of a private FileSet.  This provides the use of the default excludes patterns, which include **/CVS/**, preventing any .java files in a CVS/Base directory from being included."
18184c33c,Fixed bug where currently selected files were not showing up in the displayed diallog.
cf483b905,Incremental update.
988d113a1,Updates to reflect some design changes.
3cd138476,Corrected example for usetimestamp-attribute of get-task (by me) and Corrected examples for chmod-task Submitted by: <Jesse.Glick@netbeans.com>
bd2c472af,Make sure task list is copied.
64c4989ed,Reworking of ejbjar to support Weblogic 6. You can now specify the location of arbitrary DTDs in the ejbjar task
35853eb14,Fix up register DTD calls.
59e3705b0,Changed back to behaviour before rev1.4. VSSGET does not work on many systems if working directory and version-arguments get passed in as single arguments.
736a4d274,Support verbose-attribute for jvc (just for completeness)
8911539f3,Allow ant to handle parameters with spaces under Win systems
18382ddec,"Update to ""Ant in Anger"" regarding importing XML Submitted by:	Steve Loughran <steve_l@iseran.com>"
9b73d38e7,"The Attribute sourcefiles of the javadoc-task takes comma-separated values, not space separated."
88355d87f,Changed source structure so that constants can be retrieved from a separate class built in alternate tree. This negates the need for multiple source trees.
86aab868d,Disabled copying of source into another tree and just copied the one required constants file.
46e21ab7d,"(1) Fix <copy> task to point to the ""correct"" source directory."
ce5785476,Make <junit> work with JUnit 3.5 as well.
83dde256f,"Revert most of my last changes - one part has been wrong (pointed out by Peter) and one part doesn't work anyway, so we can leave it as it was."
9ab12cf57,Updated this to use the same approach as main wrt replacing constants in file .... strangely this one works
0cda4a725,Fix for javadoc building.
6b264d41e,Fix docs to reflect reality with respect to dist building
06e53bdfb,Copy the list of default datatypes as well.
9aad740da,Make the Bourne shell wrapper correctly deal with arguments that contain spaces.
4fd9a820a,MakeipFileSet resolve srcfile relative to project's basedir.
90380952b,Revert build process to old style for 1.3 release Rewrote build.xml using most of the ideas from the new build process
da10e54de,* Added <sysproperty> to <junit>
05f470f1d,Changes for Unix build process
8a4011348,Further tuning of the build scripts. The bootstrap now goes into the bootstrap directory to minimise interference with the CVS lib directory.
34f1e4e99,Make <fileset> inside <zip> a plain FileSet and add <zipfileset>.
58d96d54f,Restore version resource
a6c64aa16,Make sure the watched process is running before we kill it.
4887e4839,there ain't no bin dir
d94e3888d,Correctly clean up after testrun.
0fec24953,Fixed bug with looking up resources under windows.
a12e3aa77,Fixed javadoc ofip.addZipfileset
a9223a72d,Rename <transform> to <apply>
51516f38d,Move constant strings from XMLJunitResultFormatter into a separate interface - important for a new task that will follow.
6ff2c8367,"Add support for long filenames in tar task. The tar task now takes an attribute ""longfile"" which can take either the value ""truncate"" or the value ""gnu"". If the attribute is omitted, an exception is thrown (the current behaviour). Truncation is currently silent but willbe fixed to give a warning."
e9117208e,Test should be >= since we need space for the terminator.
c30a74289,Some additional enhancements to junit related classes.
c64c262ae,perform property expansion on the patterns read from files specified as includesfile or excludesfile attributes.
dfa3f12da,Fixed Bug #378.
d44e0bc4a,Build process tweaks. Source distribution now builds out of box on Solaris.
bd79701ce,<junit> wouldn't write to a file anymore.
d1895cd5a,New task <junitreport> and some improvements of DOMElementWriter
c01615380,"oops, forgot a file"
c962f816d,Made it build on systems where CLASSPATH is not se by rearrangine CP entries.
04024a63d,Change buildException to always print nested exceptions when printing its stack trace. Removed the equivalent code from DefaultLogger.
5566c8803,Handle classes which are on the classpath but which cannot be loaded due to downstream dependencies.
a7b657bd9,Add in any jars in lib/optional when doing a build.
63664a878,Add support for untaring of GNU tar files.
e5901560e,Minor format change.
10bd38594,"Made sure env vars are cleaned and CLASSPATH is not decorated with extra "" characters. It is expected that if CLASSPATH is set that it is valid and thus the extra ""'s are uneeded."
65bbae5ae,Made sure env vars are cleaned
7d7fc053b,Documented if and unless attributes of the nested include and exclude elements of PatternSet.
559fe1af1,Fixes to AntClassLoader.
247d84394,"Try to maintain the current compression setting rather than just avoiding compression, since Weblogic 6.0 generates compressed jars whereas 5.1 generates uncompressed jars"
334ac128f,Changes to wlstop and wlrun to work with weblogic 6.0
ba37bf799,enhancement to the optional task PropertyFile.
784d54ca4,Enhancements to SoundTask to allow a directory to be specified from which a random sound will be chosen.
eac9c2d1b,Copy - which is to save compiling files which have already been compiled now goes to the right place.
a1edb69c0,Unix was alread correct.
5c1e42a95,Added debug-attribute to rmic (Bug #224)
3c6126f29,Add nested filesets to tar through which file permissions can be set. This is done through an octal mode attribute. The groupname and username may also be set. See build.xml for an example usage.
a04d66471,"Make antlr test file a little better, but it still fails to pass its junit tests"
614d36db8,Fix up the location where the toplink element looks for descriptors.
9b888af8a,Initial attempt at an Anakia based webpage
dc7dd4ad8,Update version for 1.3 beta 1 build
0d651e6ce,MAIN is now 1.4 alpha
86df0b44a,"Pointers to other jakarta-projects are correct now and the other projects are now named ""Other Projects"" instead of ""SubProjects"""
cc426d1fc,"Since velocity.properties has a hardcoded path to ../../jakarta-site2 why not include all the jars jakarta-site2 provides, so that AnakiaTask should always be available?"
aca6afe8c,Update webpage - thanks Nico.
00174f8f0,Add in Log4J
620262fb9,Removed old converter hierarchy in favour of integrating it into same hierarchy as .tsks are built from.
ba3ce635b,Removed datatype package as it doesn't make sense for it to exist independent of tasklet hierarchy.
d7b7bcc56,Basic module that contains task essential to operation/bootstrapping of myrmidon/ant
7ea0a0df8,Package used to hold test cases for features of task engine
08cddc034,Module for basic functionality useful in almost all domains
7e7539a4f,Moved DataType to tasklet hierarchy as it can not exist independenct of tasklets.
2ca4d5555,Moved DataType engine components to tasklet hierarchy as it can not exist independenct of tasklets.
974322059,Updated to reflect new packaging
a7cc56a8b,Removed old tasks and moved them into module hierarchy
1b263172e,Updated to reflect new package hierarchy
22fc4ce3c,Rearranged convert package with separation of client-engine code
1b37338ca,Removed awk script now that src copy does not occur.
db81fa173,Applied patch from Deryk Sinotte that fixes problem with discontiguous selections of multiple targets.
83113cb68,"Applied Chris Wilhelm's change to provide a clear log button, and not to clear the log by default. Also added date to the start and end build messages."
ed654080a,Just changed some parameters to conform to ant standard
867ec77b0,Add a warn on longfile mode ----------------------------------------------------------------------
533748861,Merge of 1.3 branch changes into the main branch
2479bd9a1,Merge back Tar changes so they can be tested with Gump
1b319147f,Initial blurb on Antidote.
2cd09f2f1,Added a note about how to use the srcdir-attribute (not include packages there) because this seems to become a very frequently asked question.
41f7afa11,Merge in my patches from the 1.3 branch.
b5ad58c4d,orphaned change
7435b27b9,Merge 1.3 branch changes into MAIN
45524b001,Disabled the testcases which really try to access a webserver. Not everyone has one.
834eb88d8,Dump configuration information along with test output. Based on a suggestion from Stephane Bailliez.
a6e0d4857,"Increase timeout in ExecuteWatchdog test to improve its chance to pass.  The race condition is still there, this only masks the problem that a Thread that sleeps for TIME_OUT/2 might not terminate within TIME_OUT."
a6bebc97c,"Added Christoph Wilhelms' ""depends"" property editor."
a00fa243b,Rearranged packages
0352bcd52,Changed default file extentnion to .ant
5e33dfd5b,Changed sample file extentnion to .ant
53ee29f4d,Added in sketch of new item set type approach which is generalisation of current system.
9e0949cfd,Added in missing import ..
a4121e004,Added exclude when icontract is not present
16db28abf,Added IContract task
a434be361,Added name for icontract
82d33eba2,Removed stray ^M
d4300a926,Excluded pcvs from test cases as I believe it has to be localised??
c1fc82565,PCVS link
619200593,Pvcs docs
5b5fda422,Pvcs test
b00156338,Pvcs test buildfile
d12dd915d,Bleh - I really should test that it compiles no ? ;)
8a805d3dc,"Added extra test target that calls run-test as ""test"" is more common/standard"
fe83a939b,Actually add the Pvcs file
c3f979ae5,Pvcs task name added to default list
23461cba9,Readded icontract docs
2ff201801,Typo fixup
cfa93603e,By Christoph Wilhelms: Externalization of strings and removal of dependency ordering capability.
7f76769ab,Added -emacs flag.
0ae47a094,Readded IContract
78a650c54,Italicised the deprecated tasks
7a06ef0e0,Add task level logging to the list of requested features.
